data,canal,tema,resumo,resolvido
23.02.2026,telefone,problema no app,Erro ao visualizar extrato foi corrigido,sim
01.03.2026,chat,Conta por objetivos,Cliente pediu orientações sobre como separar dinheiro por metas,sim
05.03.2026,chat,Metas financeiras,Cliente acompanhou o progresso da meta de viagem pelo aplicativo,sim
10.03.2026,chat,bloqueio de cartao,Solicitacao de bloqueio de cartao por perda e emissao de novo cartao,sim
22.03.2026,telefone,desbloqueio de cartao,Desbloqueio de cartao realizado com sucesso,sim
25.03.2026,chat,CDB,"Cliente perguntou sobre rentabilidade, prazo e seguranca do produto",sim
